id,abstract,authorships.author.display_name,authorships.author.id,authorships.author.orcid,authorships.countries,authorships.institutions.display_name,authorships.institutions.id,authorships.is_corresponding,best_oa_location.license,cited_by_count,corresponding_institution_ids,display_name,doi,funders.display_name,fwci,ids.pmid,is_retracted,language,open_access.is_oa,open_access.oa_status,primary_location.source.display_name,primary_location.source.id,primary_location.source.issn_l,primary_location.source.type,primary_topic.display_name,publication_date,publication_year,type
https://openalex.org/W2953688870,,İskender Peker|Gökhan Çaybaşı|Gülçin Büyüközkan|Fethullah Göçer,https://openalex.org/A5021888329|https://openalex.org/A5086126581|https://openalex.org/A5023002566|https://openalex.org/A5078575814,https://orcid.org/0000-0001-6402-5117|https://orcid.org/0000-0002-5068-9841|https://orcid.org/0000-0002-2112-3574|https://orcid.org/0000-0001-9381-4166,TR|TR|TR|TR,Gümüşhane University|Erzincan University|Galatasaray University|Kahramanmaraş Sütçü İmam University,https://openalex.org/I143914637|https://openalex.org/I176037994|https://openalex.org/I94294566|https://openalex.org/I46017,True|False|False|False,,4,https://openalex.org/I143914637,Evaluation of Home Health Care Vehicle Routing Methods by Intuitionistic Fuzzy AHP,https://doi.org/10.1007/978-3-030-23756-1_74,,2.66718447,,False,en,False,closed,Advances in intelligent systems and computing,https://openalex.org/S2764905038,2194-5357,book series,Optimization and Mathematical Programming,2019-07-05,2019,book-chapter
https://openalex.org/W4386575393,,Fahim Ahmed|Nathan Huynh|William G. Ferrell|Vishal Badyal|Bhavya Padmanabhan,https://openalex.org/A5084168891|https://openalex.org/A5002142248|https://openalex.org/A5009174233|https://openalex.org/A5033799236|https://openalex.org/A5060836300,https://orcid.org/0000-0001-8747-3844|https://orcid.org/0000-0002-4605-5651|https://orcid.org/0000-0002-6578-522X|https://orcid.org/0000-0003-4813-9047|https://orcid.org/0000-0002-7087-5334,US|US|US|US|US,University of South Carolina|University of Nebraska–Lincoln|Clemson University|Clemson University|University of South Carolina,https://openalex.org/I155781252|https://openalex.org/I114395901|https://openalex.org/I8078737|https://openalex.org/I8078737|https://openalex.org/I155781252,False|True|False|False|False,,13,https://openalex.org/I114395901,Vehicle re-routing under disruption in cross-dock network with time constraints,https://doi.org/10.1016/j.eswa.2023.121517,,3.71167845,,False,en,False,closed,Expert Systems with Applications,https://openalex.org/S13144211,0957-4174,journal,Vehicle Routing Optimization Methods,2023-09-09,2023,article
https://openalex.org/W4408671494,,Bahar Yalçın Kavuş|Kübra Yazıcı|Alev Taşkın Gümüş|TOLGA KUDRET KARACA,https://openalex.org/A5022659480|https://openalex.org/A5101421712|https://openalex.org/A5023757814|https://openalex.org/A5087501521,https://orcid.org/0000-0001-5295-1631|https://orcid.org/0000-0003-4187-3871|https://orcid.org/0000-0003-1803-9408|,|TR|TR|,|Türkisch-Deutsche Universität|Yıldız Technical University|,|https://openalex.org/I4210101260|https://openalex.org/I4101805|,True|False|False|False,,0,,A Hybrid Ivff-Ahp and Deep Reinforcement Learning Framework for ATM Location and Routing Problem,https://doi.org/10.2139/ssrn.5186710,,,,False,en,True,green,SSRN Electronic Journal,https://openalex.org/S4210172589,1556-5068,repository,Mobile Agent-Based Network Management,2025-01-01,2025,preprint
https://openalex.org/W3040807854,"The article presents a study on the biobjective inventory routing problem.\nContrary to most previous research, the problem is treated as a true\nmulti-objective optimization problem, with the goal of identifying\nPareto-optimal solutions. Due to the hardness of the problem at hand, a\nreference point based optimization approach is presented and implemented into\nan optimization and decision support system, which allows for the computation\nof a true subset of the optimal outcomes. Experimental investigation involving\nlocal search metaheuristics are conducted on benchmark data, and numerical\nresults are reported and analyzed.\n",Martin Josef Geiger|Marc Sevaux,https://openalex.org/A5007572089|https://openalex.org/A5009130516,https://orcid.org/0000-0003-1797-957X|https://orcid.org/0000-0003-3855-9072,|,,,True|False,,8,,On the use of reference points for the biobjective Inventory Routing\n Problem,https://doi.org/10.48550/arxiv.1109.3094,,,,False,en,True,green,arXiv (Cornell University),https://openalex.org/S4306400194,,repository,Vehicle Routing Optimization Methods,2011-09-14,2011,preprint
https://openalex.org/W2382671430,,Yi Liu,https://openalex.org/A5101572583,https://orcid.org/0000-0002-6727-4407,CN,Hangzhou Dianzi University,https://openalex.org/I50760025,True,,6,https://openalex.org/I50760025,Improved Artificial Fish Swarm Algorithm for Vehicle Routing Problem with Backhaul and Fuzzy Demand,,,0.0,,False,en,False,closed,,,,,Vehicle Routing Optimization Methods,2010-01-01,2010,article
https://openalex.org/W2011234500,,Nagesh Kadaba|Kendall E. Nygard|Paul Juell,https://openalex.org/A5065753140|https://openalex.org/A5046205221|https://openalex.org/A5050013228,||,US|US|US,United Parcel Service (United States)|North Dakota State University|North Dakota State University,https://openalex.org/I1296747019|https://openalex.org/I57328836|https://openalex.org/I57328836,True|False|False,,29,https://openalex.org/I1296747019,Integration of adaptive machine learning and knowledge-based systems for routing and scheduling applications,https://doi.org/10.1016/0957-4174(91)90131-w,,2.17346153,,False,en,False,closed,Expert Systems with Applications,https://openalex.org/S13144211,0957-4174,journal,Vehicle Routing Optimization Methods,1991-01-01,1991,article
https://openalex.org/W2888927531,,Cihan Ercan|Cevriye Gencer,https://openalex.org/A5049785826|https://openalex.org/A5058053439,https://orcid.org/0000-0003-1831-7578|https://orcid.org/0000-0002-3373-8306,|,,,True|False,,4,,A Decision Support System for Dynamic Heterogeneous Unmanned Aerial System Fleets,https://doi.org/10.5072/zenodo.41308,,0.43314762,,False,en,False,closed,Gazi university journal of science,https://openalex.org/S2764902175,1303-9709,journal,Robotic Path Planning Algorithms,2018-09-01,2018,article
https://openalex.org/W4313256745,,Zeynep Aydinalp Birecik|Doğan Özgen,https://openalex.org/A5063345977|https://openalex.org/A5080666088,https://orcid.org/0000-0002-7410-2638|,TR|TR,Yıldız Technical University|Yıldız Technical University,https://openalex.org/I4101805|https://openalex.org/I4101805,True|False,,6,https://openalex.org/I4101805,An interactive possibilistic programming approach for green capacitated vehicle routing problem,https://doi.org/10.1007/s00521-022-08180-7,,0.89566712,,False,en,False,closed,Neural Computing and Applications,https://openalex.org/S147897268,0941-0643,journal,Optimization and Mathematical Programming,2022-12-27,2022,article
https://openalex.org/W3009373810,,Zhouxing Su|Zhipeng Lü|Zhuo Wang|Yanmin Qi|Una Benlic,https://openalex.org/A5006987699|https://openalex.org/A5100615617|https://openalex.org/A5100446590|https://openalex.org/A5113867075|https://openalex.org/A5015903546,https://orcid.org/0000-0002-4794-9833|https://orcid.org/0009-0006-4602-8369|https://orcid.org/0000-0002-7023-4801||,CN|CN|CN|CN|GB,Huazhong University of Science and Technology|Huazhong University of Science and Technology|Huazhong University of Science and Technology|Huazhong University of Science and Technology|Tesco (United Kingdom),https://openalex.org/I47720641|https://openalex.org/I47720641|https://openalex.org/I47720641|https://openalex.org/I47720641|https://openalex.org/I4210136998,True|False|False|False|False,,29,https://openalex.org/I47720641,A Matheuristic Algorithm for the Inventory Routing Problem,https://doi.org/10.1287/trsc.2019.0930,,3.09634908,,False,en,False,closed,Transportation Science,https://openalex.org/S130252234,0041-1655,journal,Vehicle Routing Optimization Methods,2020-03-01,2020,article
https://openalex.org/W2789591470,"Capacity uncertainty is a common issue in the transportation planning field. However, few studies discuss the intermodal routing problem with service capacity uncertainty. Based on our previous study on the intermodal routing under deterministic capacity consideration, we systematically explore how service capacity uncertainty influences the intermodal routing decision. First of all, we adopt trapezoidal fuzzy numbers to describe the uncertain information of the service capacity, and further transform the deterministic capacity constraint into a fuzzy chance constraint based on fuzzy credibility measure. We then integrate such fuzzy chance constraint into the mixed-integer linear programming (MILP) model proposed in our previous study to develop a fuzzy chance-constrained programming model. To enable the improved model to be effectively programmed in the standard mathematical programming software and solved by exact solution algorithms, a crisp equivalent linear reformulation of the fuzzy chance constraint is generated. Finally, we modify the empirical case presented in our previous study by replacing the deterministic service capacities with trapezoidal fuzzy ones. Using the modified empirical case, we utilize sensitivity analysis and fuzzy simulation to analyze the influence of service capacity uncertainty on the intermodal routing decision, and summarize some interesting insights that are helpful for decision makers.",Yan Sun|Guijie Zhang|Zhijuan Hong|Kunxiang Dong,https://openalex.org/A5087344137|https://openalex.org/A5086634848|https://openalex.org/A5036428558|https://openalex.org/A5028882079,https://orcid.org/0000-0002-4704-5578|https://orcid.org/0000-0002-7847-5431|https://orcid.org/0000-0002-2267-8782|https://orcid.org/0000-0003-4321-9347,CN|CN|CN|CN,Shandong University of Finance and Economics|Shandong University of Finance and Economics|Shandong University of Finance and Economics|Shandong University of Finance and Economics,https://openalex.org/I59483232|https://openalex.org/I59483232|https://openalex.org/I59483232|https://openalex.org/I59483232,True|False|False|True,cc-by,20,https://openalex.org/I59483232,How Uncertain Information on Service Capacity Influences the Intermodal Routing Decision: A Fuzzy Programming Perspective,https://doi.org/10.3390/info9010024,National Social Science Fund of China,2.65736785,,False,en,True,gold,Information,https://openalex.org/S4210219776,2078-2489,journal,Multi-Criteria Decision Making,2018-01-24,2018,article
https://openalex.org/W2779294482,,Ertan Yakıcı|Robert F. Dell|Travis Hartman|Connor McLemore,https://openalex.org/A5027294977|https://openalex.org/A5006570582|https://openalex.org/A5070828411|https://openalex.org/A5080629773,https://orcid.org/0000-0002-8148-1031||https://orcid.org/0000-0002-3926-6928|,TR|US|US|US,Milli Savunma Üniversitesi|Naval Academy|Naval Postgraduate School|United States Department of the Navy|Naval Postgraduate School,https://openalex.org/I4210098942|https://openalex.org/I157637111|https://openalex.org/I35364215|https://openalex.org/I3130687028|https://openalex.org/I35364215,True|False|False|False,,6,https://openalex.org/I157637111|https://openalex.org/I4210098942,Daily aircraft routing for amphibious ready groups,https://doi.org/10.1007/s10479-017-2740-8,,0.62668194,,False,en,False,closed,Annals of Operations Research,https://openalex.org/S57667410,0254-5330,journal,Vehicle Routing Optimization Methods,2017-12-21,2017,article
https://openalex.org/W2925986526,"Voyage planning is of significance considering the oil consumption, time and safety factors. Determining the proper route after considering multiple convergent factors synchronously is one of the most important subjects in ship management that requires special expertise. The purpose of this paper is to develop a fuzzy analytic hierarchy process (FAHP) extended version of Dijkstra algorithm, and investigate the most prior routing problem in maritime environment. In the literature, there exist many Dijkstra applications but these studies lack of multiple decision makers, consistency control of decision matrices and multiple criteria, which can either be cost or benefit. In this model, subjective judgments and personal experience directly involve in the decision-making process. The proposed FAHP extended Dijkstra algorithm (hereafter FAHP-Dijkstra) improves the capabilities of handling the vague criteria in the presence of fuzziness. This study aims to provide some benefits of oil consumption, time and safety to manned or unmanned ships by presenting a novel route optimization algorithm.",Bekir Şahin,https://openalex.org/A5045021460,https://orcid.org/0000-0003-2687-3419,TR,Karadeniz Technical University,https://openalex.org/I162720556,True,cc-by-nc,20,https://openalex.org/I162720556,Route Prioritization by using Fuzzy Analytic Hierarchy Process extended Dijkstra Algorithm,https://doi.org/10.5505/jems.2019.39306,,2.62688146,,False,en,True,diamond,Journal of ETA Maritime Science,https://openalex.org/S2738395297,2147-2955,journal,Data Management and Algorithms,2019-01-01,2019,article
https://openalex.org/W4403516281,"With the rapid advancement of drone technology, the efficient distribution of drones has garnered significant attention. Central to this discourse is the energy consumption of drones, a critical metric for assessing energy-efficient distribution strategies. Accordingly, this study delves into the energy consumption factors affecting drone distribution. A primary challenge in drone distribution lies in devising optimal, energy-efficient routes for drones. However, traditional routing algorithms, predominantly heuristic-based, exhibit certain limitations. These algorithms often rely on heuristic rules and expert knowledge, which can constrain their ability to escape local optima. Motivated by these shortcomings, we propose a novel multi-agent deep reinforcement learning algorithm that integrates a drone energy consumption model, namely EMADRL. The EMADRL algorithm first formulates the drone routing problem within a multi-agent reinforcement learning framework. It subsequently designs a strategy network model comprising multiple agent networks, tailored to address the node adjacency and masking complexities typical of multi-depot vehicle routing problem. Training utilizes strategy gradient algorithms and attention mechanisms. Furthermore, local and sampling search strategies are introduced to enhance solution quality. Extensive experimentation demonstrates that EMADRL consistently achieves high-quality solutions swiftly. A comparative analysis against contemporary algorithms reveals EMADRL’s superior energy efficiency, with average energy savings of 5.96% and maximum savings reaching 12.45%. Thus, this approach offers a promising new avenue for optimizing energy consumption in last-mile distribution scenarios.",Xiu Shu|Anping Lin|Xupeng Wen,https://openalex.org/A5078453286|https://openalex.org/A5091273730|https://openalex.org/A5062636672,https://orcid.org/0000-0002-1205-9662|https://orcid.org/0000-0001-5219-4378|https://orcid.org/0000-0002-4498-3745,CN|CN|,Jiangsu University of Science and Technology|Xiangnan University|,https://openalex.org/I4210096899|https://openalex.org/I43081956|,True|False|False,cc-by,7,https://openalex.org/I4210096899,Energy-Saving Multi-Agent Deep Reinforcement Learning Algorithm for Drone Routing Problem,https://doi.org/10.3390/s24206698,,9.23374298,https://pubmed.ncbi.nlm.nih.gov/39460178,False,en,True,gold,Sensors,https://openalex.org/S101949793,1424-8220,journal,UAV Applications and Optimization,2024-10-18,2024,article
https://openalex.org/W596795832,,Emilio Corchado|Bing-Yuan Cao,https://openalex.org/A5110181529|https://openalex.org/A5079293684,|https://orcid.org/0000-0003-3589-5441,|,,,True|False,,25,,Fuzzy Information and Engineering,https://doi.org/10.1007/978-3-540-71441-5,,0.15534709,,False,en,False,closed,Advances in soft computing,https://openalex.org/S4210167543,1615-3871,book series,Fuzzy Logic and Control Systems,2007-01-01,2007,book
https://openalex.org/W3088857365,"A routing optimization with risk control and reduction provides a quantitative support for an efficient organization of the hazardous materials transportation where road-rail multimodal transportation plays an important role. Oriented on the viewpoint of the multimodal operator, this study investigates a hazardous materials routing problem for their door-to-door transportation through a road-rail multimodal hub-and-spoke network. It is difficult to determine the exact demand of hazardous materials for each transportation order during the advanced routing decision making. Therefore, demand uncertainty is introduced into the problem, in which the uncertain demands are modeled by triangular fuzzy numbers. To enhance the quality of service of the transportation, the hazardous materials routing optimization in this study uses fuzzy soft time windows to optimize the last-mile delivery of hazardous materials that determines the timeliness of transportation. Accordingly, this study proposes a fuzzy multi-objective routing model that is linear and considers the constraints of the customers' preferred service levels. To solve the proposed model, its crisp reformulation is first achieved by using the fuzzy expected value method and Jimenez's fuzzy ranking method. Then, the &#x03B5;-constraint method is adopted by this study to obtain the Pareto frontier for the multi-objective optimization problem. Finally, an experimental case study is carried out to verify the proposed modeling of this study. By using sensitivity analysis and fuzzy simulation, the conflicting relationship among the economic, risk, reliability and timeliness objectives that improving one objective worsens the others is clearly indicated, and the insights that helps decision makers to make effective tradeoffs among these objectives to get a most suitable hazardous materials road-rail multimodal transportation plan are also summarized.",Yan Sun,https://openalex.org/A5087344137,https://orcid.org/0000-0002-4704-5578,CN,Shandong University of Finance and Economics,https://openalex.org/I59483232,True,cc-by,24,https://openalex.org/I59483232,A Fuzzy Multi-Objective Routing Model for Managing Hazardous Materials Door-to-Door Transportation in the Road-Rail Multimodal Network With Uncertain Demand and Improved Service Level,https://doi.org/10.1109/access.2020.3025315,National Natural Science Foundation of China|Ministry of Education of the People's Republic of China|Natural Science Foundation of Shandong Province,4.05697773,,False,en,True,gold,IEEE Access,https://openalex.org/S2485537415,2169-3536,journal,Transportation Planning and Optimization,2020-01-01,2020,article
https://openalex.org/W4406834022,"As global supply chains become more intricate, the significance of supply chain risk management has significantly increased. This research delves into the utilization of artificial intelligence (AI) in managing supply chain risks, analyzing cutting-edge advancements, obstacles, and potential areas for further exploration. Through a comprehensive review of literature sources like Google Scholar, Web of Science, EI, and Scopus, this study investigates how AI methods such as machine learning, deep learning, neural networks, fuzzy logic, genetic algorithms, and evolutionary algorithms can help mitigate supply chain risks. These AI technologies have demonstrated remarkable efficacy in mitigating various risks, including forecasting, anomaly detection, image recognition, text mining, logistics optimization, and emergency response tactics. Apart from AI-driven approaches, optimization solvers and algorithms play a critical role in tackling complex supply chain dilemmas. Mathematical programming solvers, including linear programming (LP), mixed-integer programming (MIP), and quadratic programming (QP), are commonly used to model and optimize supply chain networks by considering factors like cost, capacity, and demand fluctuations. Fine-tuning solver parameters and strategies to enhance computational efficiency—known as solver tuning—has been crucial in enhancing solution quality and decreasing computation time for large-scale supply chain issues. Heuristic solvers like genetic algorithms, simulated annealing, and ant colony optimization are frequently employed to resolve conflicts in supply chains. These solvers offer practical solutions to problems where exact methods are computationally impractical, allowing for swift responses to disruptions such as production delays or spikes in demand. Pyramid classification, a hierarchical approach, further refines decision-making by categorizing risks and aligning response strategies based on priority and severity. Furthermore, the integration of AI technologies and solvers enables advanced conflict resolution techniques, including scenario-based modeling and multi-objective optimization. These approaches enable decision-makers to weigh trade-offs between conflicting objectives like minimizing costs versus maximizing service levels in real-time. The study underscores that AI technologies and optimization solvers significantly bolster risk management in supply chains. Nonetheless, challenges such as data privacy concerns, security vulnerabilities, technical intricacies, and implementation obstacles pose critical barriers to widespread adoption. The study offers practical suggestions for businesses and decision-makers while pinpointing key areas for future exploration, such as devising hybrid models that merge heuristic solvers with AI for adaptive and scalable risk management strategies.",Nitin Grover,https://openalex.org/A5116036846,,,,,True,,23,,AI-Enabled Supply Chain Optimization,https://doi.org/10.48175/ijarsct-23103,,134.32160552,,False,en,True,diamond,International Journal of Advanced Research in Science Communication and Technology,https://openalex.org/S4210201094,2581-9429,journal,Supply Chain Resilience and Risk Management,2025-01-26,2025,article
https://openalex.org/W4221015978,,Ali Majidi|Pedram Farghadani-Chaharsooghi|Seyed Mohammad Javad Mirzapour Al-e-Hashem,https://openalex.org/A5065487410|https://openalex.org/A5017404647|https://openalex.org/A5071939453,|https://orcid.org/0000-0002-6544-3801|https://orcid.org/0000-0002-3235-2698,IR|CA|IR|FR|IR,Amirkabir University of Technology|Amirkabir University of Technology|Concordia University|École Supérieure de Commerce de Rennes|Amirkabir University of Technology,https://openalex.org/I158248296|https://openalex.org/I158248296|https://openalex.org/I60158472|https://openalex.org/I92834545|https://openalex.org/I158248296,True|False|False,,20,https://openalex.org/I158248296,Sustainable Pricing-Production-Workforce-Routing Problem for Perishable Products by Considering Demand Uncertainty; A Case Study from the Dairy Industry,https://doi.org/10.5325/transportationj.61.1.0060,,3.171275,,False,en,False,closed,Transportation Journal,https://openalex.org/S121321708,0041-1612,journal,Vehicle Routing Optimization Methods,2022-01-01,2022,article
