id,abstract,authorships.author.display_name,authorships.author.id,authorships.author.orcid,authorships.countries,authorships.institutions.display_name,authorships.institutions.id,authorships.is_corresponding,best_oa_location.license,cited_by_count,corresponding_institution_ids,display_name,doi,funders.display_name,fwci,ids.pmid,is_retracted,language,open_access.is_oa,open_access.oa_status,primary_location.source.display_name,primary_location.source.id,primary_location.source.issn_l,primary_location.source.type,primary_topic.display_name,publication_date,publication_year,type
https://openalex.org/W2070911198,,Yanfang Ma|Jiuping Xu,https://openalex.org/A5100909062|https://openalex.org/A5100691507,|https://orcid.org/0000-0003-3756-3969,CN|CN,Sichuan University|Sichuan University|State Key Laboratory of Hydraulics and Mountain River Engineering,https://openalex.org/I24185976|https://openalex.org/I24185976|https://openalex.org/I4391767678,False|True,,24,https://openalex.org/I24185976|https://openalex.org/I4391767678,A cloud theory-based particle swarm optimization for multiple decision maker vehicle routing problems with fuzzy random time windows,https://doi.org/10.1080/0305215x.2014.928815,National Natural Science Foundation of China,6.53976771,,False,en,False,closed,Engineering Optimization,https://openalex.org/S139857051,0305-215X,journal,Vehicle Routing Optimization Methods,2014-06-30,2014,article
https://openalex.org/W4211132698,,Merve Cengiz Toklu,https://openalex.org/A5067026110,https://orcid.org/0000-0001-9609-5136,TR,Sakarya University,https://openalex.org/I103703290,True,,25,https://openalex.org/I103703290,A fuzzy multi-criteria approach based on Clarke and Wright savings algorithm for vehicle routing problem in humanitarian aid distribution,https://doi.org/10.1007/s10845-022-01917-0,,6.40922692,,False,en,False,closed,Journal of Intelligent Manufacturing,https://openalex.org/S161464388,0956-5515,journal,Facility Location and Emergency Management,2022-02-11,2022,article
https://openalex.org/W2999440819,,Sadia Samar Ali|Turan Paksoy|Belkız Torğul|Rajbir Kaur,https://openalex.org/A5073413581|https://openalex.org/A5044986871|https://openalex.org/A5088260635|https://openalex.org/A5015303455,https://orcid.org/0000-0003-4911-5725|https://orcid.org/0000-0001-8051-8560|https://orcid.org/0000-0002-7341-9334|https://orcid.org/0000-0003-1433-1065,|||,,,True|False|False|False,,77,,Reverse logistics optimization of an industrial air conditioner manufacturing company for designing sustainable supply chain: a fuzzy hybrid multi-criteria decision-making approach,https://doi.org/10.1007/s11276-019-02246-6,,10.42205033,,False,en,False,closed,Wireless Networks,https://openalex.org/S205498627,1022-0038,journal,Sustainable Supply Chain Management,2020-01-11,2020,article
https://openalex.org/W2254975279,,Yanfang Ma|Jiuping Xu,https://openalex.org/A5100909062|https://openalex.org/A5100691507,|https://orcid.org/0000-0003-3756-3969,|,,,True|False,,12,,Vehicle routing problem with multiple decision-makers for construction material transportation in a fuzzy random environment,,,2.97262168,,False,en,False,closed,,,,,Advanced Manufacturing and Logistics Optimization,2014-06-10,2014,article
https://openalex.org/W854438218,,Fatemeh Torfi|Reza Zanjirani Farahani|Iraj Mahdavi,https://openalex.org/A5005736969|https://openalex.org/A5044837172|https://openalex.org/A5087753439,|https://orcid.org/0000-0002-7383-4714|https://orcid.org/0000-0001-5123-6169,IR|GB|IR,Mazandaran University of Science and Technology|Islamic Azad University Semnan|Kingston University|Mazandaran University of Science and Technology,https://openalex.org/I123173325|https://openalex.org/I4210104301|https://openalex.org/I205051169|https://openalex.org/I123173325,False|False|True,,27,https://openalex.org/I123173325,Fuzzy MCDM for weight of object’s phrase in location routing problem,https://doi.org/10.1016/j.apm.2015.06.001,,5.69532078,,False,en,False,closed,Applied Mathematical Modelling,https://openalex.org/S153281200,0307-904X,journal,Multi-Criteria Decision Making,2015-07-04,2015,article
https://openalex.org/W2090322985,"This paper presents a decision support system for the optimization of long distance freight transport by road in the Iberian Peninsula (Spain and Portugal) between several origins and destinations without warehouses at the origin and the final destination. In every order, there is at least one origin and one destination, and these two positions do not need to coincide with other origin/destination pairs for different orders. This can be considered to be a many-to-many type problem, where the freight is picked up at different customer locations and delivered in other client locations. The aim of the system described consists of helping traffic managers of freight transport companies to reduce operational costs by optimizing the loading of freight in vehicles, optimizing routes and grouping orders following certain load/unload procedures in such a way that pick-up and delivery activities can be previously planned. For the resolution of the problem, it is proposed an algorithm based on ant optimization techniques which has allowed the system to be modeled taking into account its most characteristic peculiarities: no depots at the beginning and end of the route, a maximum driving time per day, the capacity of vehicles, the compatibility of types of goods in the same vehicle, customers with time windows to pickup/deliver goods, and the manner of loading/unloading vehicles (Last Input First Output). The effectiveness of the algorithm has been proved using data from real problems. The basis of our computational experiments is the historical data from a large transport company in the Iberian Peninsula.",Juan Antonio Sicilia Montalvo|Beatriz Royo|Emilio Larrodé|Alberto Fraile,https://openalex.org/A5084194142|https://openalex.org/A5068884852|https://openalex.org/A5068168573|https://openalex.org/A5081342790,https://orcid.org/0000-0002-5962-4147|https://orcid.org/0000-0001-8208-716X|https://orcid.org/0000-0002-5857-8003|https://orcid.org/0000-0001-9861-0728,ES|ES|ES|ES,Universidad de Zaragoza|Universidad de Zaragoza|Universidad de Zaragoza|Universidad de Zaragoza,https://openalex.org/I255234318|https://openalex.org/I255234318|https://openalex.org/I255234318|https://openalex.org/I255234318,False|False|False|True,cc-by-nc-nd,12,https://openalex.org/I255234318,A Decision Support System for a Long-distance Routing Problem based on the Ant Colony Optimization Metaheuristic,https://doi.org/10.1016/j.sbspro.2014.01.138,,1.78357301,,False,en,True,diamond,Procedia - Social and Behavioral Sciences,https://openalex.org/S104917558,1877-0428,journal,Vehicle Routing Optimization Methods,2014-02-01,2014,article
https://openalex.org/W3186940976,,Fatma Demircan Keskin,https://openalex.org/A5041568434,https://orcid.org/0000-0002-7000-4731,TR,Ege University,https://openalex.org/I41641357,True,,1,https://openalex.org/I41641357,Multi-Criteria Decision Making With Machine Learning for Vehicle Routing Problem,https://doi.org/10.4018/978-1-7998-8040-0.ch011,,0.61281002,,False,en,False,closed,"Advances in logistics, operations, and management science book series",https://openalex.org/S4210223929,2327-350X,book series,Vehicle Routing Optimization Methods,2021-01-01,2021,book-chapter
https://openalex.org/W2019206043,,Heung-Suk Hwang|Bae-Suk Choi|Kiwook Lee|Gyu-Sung Cho,https://openalex.org/A5112030873|https://openalex.org/A5029536336|https://openalex.org/A5031249207|https://openalex.org/A5026925767,||https://orcid.org/0000-0003-0720-6012|https://orcid.org/0000-0002-1289-4908,KR|KR|KR|KR,Tongmyong University|Tongmyong University|Tongmyong University|Tongmyong University,https://openalex.org/I4210104306|https://openalex.org/I4210104306|https://openalex.org/I4210104306|https://openalex.org/I4210104306,True|False|False|False,,4,https://openalex.org/I4210104306,Supply Center Planning Model Using Fuzzy-AHP and VRP,https://doi.org/10.1109/icicic.2008.529,,0.77282498,,False,en,False,closed,,,,,Vehicle Routing Optimization Methods,2008-01-01,2008,article
https://openalex.org/W4224138275,,Weixu Pan|Shi Qiang Liu,https://openalex.org/A5023194872|https://openalex.org/A5048616343,|https://orcid.org/0000-0002-2370-5519,CN|CN,Fuzhou University|Fuzhou University,https://openalex.org/I80947539|https://openalex.org/I80947539,True|False,,120,https://openalex.org/I80947539,Deep reinforcement learning for the dynamic and uncertain vehicle routing problem,https://doi.org/10.1007/s10489-022-03456-w,National Natural Science Foundation of China,11.3949084,,False,en,False,closed,Applied Intelligence,https://openalex.org/S74726891,0924-669X,journal,Transportation and Mobility Innovations,2022-04-18,2022,article
https://openalex.org/W4411338456,"The impact of alternative distribution channels, such as bank Automated Teller Machines (ATMs), on the financial industry is growing due to technological advancements. Investing in ideal locations is critical for new ATM companies. Due to the many factors to be evaluated, this study addresses the problem of determining the best location for ATMs to be deployed in Istanbul districts by utilizing the multi-criteria decision-making framework. Furthermore, the advantages of fuzzy logic are used to convert expert opinions into mathematical expressions and incorporate them into decision-making processes. For the first time in the literature, a model has been proposed for ATM location selection, integrating clustering and the interval-valued Fermatean fuzzy analytic hierarchy process (IVFF-AHP). With the proposed methodology, the districts of Istanbul are first clustered to find the risky ones. Then, the most suitable alternative location in this district is determined using IVFF-AHP. After deciding the ATM locations with IVFF-AHP, in the last step, a Double Deep Q-Network Reinforcement Learning model is used to optimize the Cash in Transit (CIT) vehicle route. The study results reveal that the proposed approach provides stable, efficient, and adaptive routing for real-world CIT operations.",Bahar Yalçın Kavuş|Kübra Yazıcı|Alev Taşkın Gümüş|Tolga Kudret Karaca,https://openalex.org/A5022659480|https://openalex.org/A5101421712|https://openalex.org/A5023757814|https://openalex.org/A5036944001,https://orcid.org/0000-0001-5295-1631|https://orcid.org/0000-0003-4187-3871|https://orcid.org/0000-0003-1803-9408|https://orcid.org/0000-0001-5562-6367,TR|TR|AZ|TR|TR,Yıldız Technical University|Izmir Kâtip Çelebi University|Türkisch-Deutsche Universität|Yıldız Technical University|Yıldız Technical University|Azerbaijan State University of Economics|Istanbul University,https://openalex.org/I4101805|https://openalex.org/I250383648|https://openalex.org/I4210101260|https://openalex.org/I4101805|https://openalex.org/I4101805|https://openalex.org/I4210086371|https://openalex.org/I67581229,False|False|False|True,cc-by,1,https://openalex.org/I67581229,A Hybrid IVFF-AHP and Deep Reinforcement Learning Framework for an ATM Location and Routing Problem,https://doi.org/10.3390/app15126747,,5.16502407,,False,en,True,gold,Applied Sciences,https://openalex.org/S4210205812,2076-3417,journal,Optimization and Search Problems,2025-06-16,2025,article
https://openalex.org/W2170302854,,Christos D. Tarantilis|C.T. Kiranoudis,https://openalex.org/A5114000025|https://openalex.org/A5110143069,|,GR|GR,National Technical University of Athens|National Technical University of Athens,https://openalex.org/I174458059|https://openalex.org/I174458059,False|True,other-oa,88,https://openalex.org/I174458059,Using a spatial decision support system for solving the vehicle routing problem,https://doi.org/10.1016/s0378-7206(01)00103-3,,12.79359583,,False,en,True,green,Information & Management,https://openalex.org/S38883057,0378-7206,journal,Vehicle Routing Optimization Methods,2002-03-01,2002,article
https://openalex.org/W2974466578,,Yu Yao|Xiaoning Zhu|Hongyu Dong|Shengnan Wu|Hailong Wu|Lu Tong|Xuesong Zhou,https://openalex.org/A5042458207|https://openalex.org/A5035291761|https://openalex.org/A5070778072|https://openalex.org/A5056217038|https://openalex.org/A5101486755|https://openalex.org/A5077039307|https://openalex.org/A5047902154,https://orcid.org/0000-0002-7686-3940|https://orcid.org/0000-0003-3947-4580|https://orcid.org/0000-0001-9591-7847|https://orcid.org/0000-0001-9193-6071|https://orcid.org/0009-0006-0997-4567|https://orcid.org/0000-0002-2574-9689|https://orcid.org/0000-0002-9963-5369,CN|CN|CN|CN|CN|CN|US,Beijing Jiaotong University|Beijing Jiaotong University|Jingdong (China)|Jingdong (China)|Jingdong (China)|Beihang University|Arizona State University,https://openalex.org/I21193070|https://openalex.org/I21193070|https://openalex.org/I4210103986|https://openalex.org/I4210103986|https://openalex.org/I4210103986|https://openalex.org/I82880672|https://openalex.org/I55732556,False|False|True|False|False|False|True,,118,https://openalex.org/I4210103986|https://openalex.org/I55732556,ADMM-based problem decomposition scheme for vehicle routing problem with time windows,https://doi.org/10.1016/j.trb.2019.09.009,National Science Foundation|National Natural Science Foundation of China|National Key Research and Development Program of China,8.34324038,,False,en,False,closed,Transportation Research Part B Methodological,https://openalex.org/S96305778,0191-2615,journal,Vehicle Routing Optimization Methods,2019-09-17,2019,article
https://openalex.org/W2519694694,,Can B. Kalaycı|Can Kaya,https://openalex.org/A5059437165|https://openalex.org/A5109680802,https://orcid.org/0000-0003-2355-7015|,TR|TR,Pamukkale University|Pamukkale University,https://openalex.org/I48843708|https://openalex.org/I48843708,True|False,,141,https://openalex.org/I48843708,An ant colony system empowered variable neighborhood search algorithm for the vehicle routing problem with simultaneous pickup and delivery,https://doi.org/10.1016/j.eswa.2016.09.017,,19.17545752,,False,en,False,closed,Expert Systems with Applications,https://openalex.org/S13144211,0957-4174,journal,Vehicle Routing Optimization Methods,2016-09-12,2016,article
https://openalex.org/W2062512894,,Yannis Marinakis|Athanasios Migdalas|Pãnos M. Pardalos,https://openalex.org/A5058880006|https://openalex.org/A5011299350|https://openalex.org/A5050062467,https://orcid.org/0000-0002-1989-5815|https://orcid.org/0000-0001-8473-3663|https://orcid.org/0000-0001-9623-8053,GR|GR|US,Technical University of Crete|Technical University of Crete|University of Florida,https://openalex.org/I55741626|https://openalex.org/I55741626|https://openalex.org/I33213144,True|False|False,,87,https://openalex.org/I55741626,A new bilevel formulation for the vehicle routing problem and a solution method using a genetic algorithm,https://doi.org/10.1007/s10898-006-9094-0,,7.99290256,,False,en,False,closed,Journal of Global Optimization,https://openalex.org/S115925768,0925-5001,journal,Vehicle Routing Optimization Methods,2006-10-26,2006,article
https://openalex.org/W1992027359,,Christos D. Tarantilis|D. Diakoulaki|C.T. Kiranoudis,https://openalex.org/A5114000025|https://openalex.org/A5082439294|https://openalex.org/A5110143069,|https://orcid.org/0000-0002-3050-6964|,GR|GR|GR,National Technical University of Athens|National Technical University of Athens|National Technical University of Athens,https://openalex.org/I174458059|https://openalex.org/I174458059|https://openalex.org/I174458059,True|False|False,other-oa,91,https://openalex.org/I174458059,Combination of geographical information system and efficient routing algorithms for real life distribution operations,https://doi.org/10.1016/s0377-2217(03)00035-3,,10.57995073,,False,en,True,green,European Journal of Operational Research,https://openalex.org/S103321696,0377-2217,journal,Vehicle Routing Optimization Methods,2003-04-04,2003,article
https://openalex.org/W3135029437,,Navid Akbarpour|Amirhossein Salehi-Amiri|Mostafa Hajiaghaei–Keshteli|Diego Oliva,https://openalex.org/A5062086912|https://openalex.org/A5052115613|https://openalex.org/A5089725678|https://openalex.org/A5056251028,|https://orcid.org/0000-0001-5980-8192|https://orcid.org/0000-0002-9988-2626|,MX|CA|MX|ES|MX,Tecnológico de Monterrey|École de Technologie Supérieure|Université du Québec à Montréal|Tecnológico de Monterrey|Universidad de Guadalajara|Universitat Oberta de Catalunya,https://openalex.org/I98461037|https://openalex.org/I9736820|https://openalex.org/I159129438|https://openalex.org/I98461037|https://openalex.org/I193181351|https://openalex.org/I138847295,True|False|False|False,,114,https://openalex.org/I98461037,An innovative waste management system in a smart city under stochastic optimization using vehicle routing problem,https://doi.org/10.1007/s00500-021-05669-6,,12.66555162,,False,en,False,closed,Soft Computing,https://openalex.org/S65753830,1432-7643,journal,Municipal Solid Waste Management,2021-03-05,2021,article
https://openalex.org/W2192152020,,Geir Hasle|Oddvar Kloster,https://openalex.org/A5003369175|https://openalex.org/A5026720871,https://orcid.org/0000-0003-0546-2792|https://orcid.org/0000-0002-2025-4257,NO|NO,SINTEF|SINTEF,https://openalex.org/I173888879|https://openalex.org/I173888879,True|False,,64,https://openalex.org/I173888879,Industrial Vehicle Routing,https://doi.org/10.1007/978-3-540-68783-2_12,,2.32088086,,False,en,False,closed,,,,,Vehicle Routing Optimization Methods,2007-06-08,2007,book-chapter
https://openalex.org/W2964487007,,Alexandra Anderluh|Pamela C. Nolz|Vera Hemmelmayr|Teodor Gabriel Crainic,https://openalex.org/A5046351276|https://openalex.org/A5026797750|https://openalex.org/A5003516995|https://openalex.org/A5041183626,https://orcid.org/0000-0001-7337-0799|https://orcid.org/0000-0002-1169-6248|https://orcid.org/0000-0002-6086-1019|https://orcid.org/0000-0002-4424-0984,AT||AT|CA,"Bundesministerium für Klimaschutz, Umwelt, Energie, Mobilität, Innovation und Technologie||Bundesministerium für Klimaschutz, Umwelt, Energie, Mobilität, Innovation und Technologie|Université du Québec à Montréal|Université de Montréal",https://openalex.org/I1317784204||https://openalex.org/I1317784204|https://openalex.org/I159129438|https://openalex.org/I70931966,True|False|False|False,cc-by,140,https://openalex.org/I1317784204,Multi-objective optimization of a two-echelon vehicle routing problem with vehicle synchronization and ‘grey zone’ customers arising in urban logistics,https://doi.org/10.1016/j.ejor.2019.07.049,Österreichische Forschungsförderungsgesellschaft|Natural Sciences and Engineering Research Council of Canada,10.97794787,,False,en,True,hybrid,European Journal of Operational Research,https://openalex.org/S103321696,0377-2217,journal,Vehicle Routing Optimization Methods,2019-07-28,2019,article
https://openalex.org/W3156997004,,Mohammad Shokouhifar,https://openalex.org/A5048004042,https://orcid.org/0000-0001-7370-4760,IR,Shahid Beheshti University,https://openalex.org/I48379061,True,,88,https://openalex.org/I48379061,FH-ACO: Fuzzy heuristic-based ant colony optimization for joint virtual network function placement and routing,https://doi.org/10.1016/j.asoc.2021.107401,,12.42238169,,False,en,False,closed,Applied Soft Computing,https://openalex.org/S140556538,1568-4946,journal,Software-Defined Networks and 5G,2021-04-19,2021,article
https://openalex.org/W2530665380,,Mohammadbagher Afshar-Bakeshloo|Ali D. Mehrabi|Hossein Safari|Meysam Maleki|Fariborz Jolai,https://openalex.org/A5060592862|https://openalex.org/A5071239120|https://openalex.org/A5050984581|https://openalex.org/A5036442203|https://openalex.org/A5019047127,https://orcid.org/0000-0002-7783-6477||https://orcid.org/0000-0001-9232-1319|https://orcid.org/0000-0002-1111-0358|https://orcid.org/0000-0003-0824-8513,IR|IR|IR|PT|IR,University of Tehran|Shahid Chamran University of Ahvaz|University of Tehran|Universidade Nova de Lisboa|University of Tehran,https://openalex.org/I23946033|https://openalex.org/I196051555|https://openalex.org/I23946033|https://openalex.org/I83558840|https://openalex.org/I23946033,True|False|False|False|False,cc-by,67,https://openalex.org/I23946033,A green vehicle routing problem with customer satisfaction criteria,https://doi.org/10.1007/s40092-016-0163-9,,6.26137388,,False,en,True,diamond,Journal of industrial engineering international,https://openalex.org/S2764809327,1735-5702,journal,Vehicle Routing Optimization Methods,2016-08-09,2016,article
https://openalex.org/W2980272392,,Mukesh Kumar Mehlawat|Pankaj Gupta|Anisha Khaitan|Witold Pedrycz,https://openalex.org/A5063421319|https://openalex.org/A5100746367|https://openalex.org/A5013764719|https://openalex.org/A5003799782,https://orcid.org/0000-0002-2516-009X|https://orcid.org/0000-0002-1963-7998|https://orcid.org/0000-0002-2060-9206|https://orcid.org/0000-0002-9335-9930,IN|IN|IN|CA|PL|SA,University of Delhi|University of Delhi|University of Delhi|Systems Research Institute|King Abdulaziz University|University of Alberta|Polish Academy of Sciences,https://openalex.org/I110166357|https://openalex.org/I110166357|https://openalex.org/I110166357|https://openalex.org/I66083562|https://openalex.org/I185163786|https://openalex.org/I154425047|https://openalex.org/I99542240,True|False|False|False,,56,https://openalex.org/I110166357,A Hybrid Intelligent Approach to Integrated Fuzzy Multiple Depot Capacitated Green Vehicle Routing Problem With Split Delivery and Vehicle Selection,https://doi.org/10.1109/tfuzz.2019.2946110,,5.48897394,,False,en,False,closed,IEEE Transactions on Fuzzy Systems,https://openalex.org/S134177497,1063-6706,journal,Vehicle Routing Optimization Methods,2019-10-07,2019,article
https://openalex.org/W1978890896,,Ilkyeong Moon|Jeong Hun Lee|June Seong,https://openalex.org/A5007848705|https://openalex.org/A5101912661|https://openalex.org/A5062428688,https://orcid.org/0000-0002-7072-1351|https://orcid.org/0000-0001-8640-7087|,KR|KR|,Pusan National University|Electronics and Telecommunications Research Institute|,https://openalex.org/I4921948|https://openalex.org/I142401562|,False|True|False,,41,https://openalex.org/I142401562,Vehicle routing problem with time windows considering overtime and outsourcing vehicles,https://doi.org/10.1016/j.eswa.2012.05.081,Pusan National University,6.72504929,,False,en,False,closed,Expert Systems with Applications,https://openalex.org/S13144211,0957-4174,journal,Vehicle Routing Optimization Methods,2012-06-09,2012,article
https://openalex.org/W1983258309,,Ángel A. Juan|Javier Faulín|Rubén Ruíz|Barry B. Barrios|Santi Caballé,https://openalex.org/A5080136207|https://openalex.org/A5022916875|https://openalex.org/A5027802981|https://openalex.org/A5078457630|https://openalex.org/A5034290489,https://orcid.org/0000-0003-1392-1776|https://orcid.org/0000-0002-2613-6155|https://orcid.org/0000-0003-3295-3888||https://orcid.org/0000-0002-2490-6830,ES|ES|ES|ES|ES,Universitat Oberta de Catalunya|Universidad Publica de Navarra|Universitat Politècnica de València|Universidad Publica de Navarra|Universitat Oberta de Catalunya,https://openalex.org/I138847295|https://openalex.org/I175051016|https://openalex.org/I60053951|https://openalex.org/I175051016|https://openalex.org/I138847295,True|False|False|False|False,,102,https://openalex.org/I138847295,The SR-GCWS hybrid algorithm for solving the capacitated vehicle routing problem,https://doi.org/10.1016/j.asoc.2009.07.003,,17.28051222,,False,en,False,closed,Applied Soft Computing,https://openalex.org/S140556538,1568-4946,journal,Vehicle Routing Optimization Methods,2009-07-12,2009,article
https://openalex.org/W3010566549,,Antonio Giallanza|Gabriella Li Puma,https://openalex.org/A5089471212|https://openalex.org/A5039031908,https://orcid.org/0000-0001-8923-2454|,IT|IT,University of Palermo|University of Palermo,https://openalex.org/I900890020|https://openalex.org/I900890020,True|False,,64,https://openalex.org/I900890020,Fuzzy green vehicle routing problem for designing a three echelons supply chain,https://doi.org/10.1016/j.jclepro.2020.120774,,11.34845481,,False,en,False,closed,Journal of Cleaner Production,https://openalex.org/S58516903,0959-6526,journal,Sustainable Supply Chain Management,2020-02-29,2020,article
https://openalex.org/W2061625746,,Canhong Lin|K.L. Choy|G.T.S. Ho|H.Y. Lam|G.K.H. Pang|Kwai‐Sang Chin,https://openalex.org/A5066402465|https://openalex.org/A5043105230|https://openalex.org/A5021070500|https://openalex.org/A5046635440|https://openalex.org/A5050782286|https://openalex.org/A5035869274,|https://orcid.org/0000-0001-9252-1476|https://orcid.org/0000-0002-8550-4974|https://orcid.org/0000-0002-5858-1894|https://orcid.org/0000-0003-2257-2301|https://orcid.org/0000-0002-7029-007X,HK|HK|HK|HK|HK|HK,Hong Kong Polytechnic University|Hong Kong Polytechnic University|Hong Kong Polytechnic University|Hong Kong Polytechnic University|Hong Kong University of Science and Technology|University of Hong Kong|City University of Hong Kong,https://openalex.org/I14243506|https://openalex.org/I14243506|https://openalex.org/I14243506|https://openalex.org/I14243506|https://openalex.org/I200769079|https://openalex.org/I889458895|https://openalex.org/I168719708,False|True|False|False|False|False,,62,https://openalex.org/I14243506,A decision support system for optimizing dynamic courier routing operations,https://doi.org/10.1016/j.eswa.2014.04.036,,12.48501108,,False,en,False,closed,Expert Systems with Applications,https://openalex.org/S13144211,0957-4174,journal,Vehicle Routing Optimization Methods,2014-05-10,2014,article
