id,abstract,authorships.author.display_name,authorships.author.id,authorships.author.orcid,authorships.countries,authorships.institutions.display_name,authorships.institutions.id,authorships.is_corresponding,best_oa_location.license,cited_by_count,corresponding_institution_ids,display_name,doi,funders.display_name,fwci,ids.pmid,is_retracted,language,open_access.is_oa,open_access.oa_status,primary_location.source.display_name,primary_location.source.id,primary_location.source.issn_l,primary_location.source.type,primary_topic.display_name,publication_date,publication_year,type
https://openalex.org/W4387265247,"Maritime emergency materials distribution is a key aspect of maritime emergency responses. To effectively deal with the challenges brought by the uncertainty of the maritime transport environment, the multi-agent joint decision-making location-routing problem of maritime emergency materials distribution (MEMD-LRP) under an uncertain decision-making environment is studied. First, two robust bi-level optimization models of MEMD-LRP are constructed based on the effect of the uncertainty of the ship’s sailing time and demand of emergency materials at the accident point, respectively, on the premise of considering the rescue time window and priority of emergency materials distribution. Secondly, with the help of robust optimization theory and duality theory, the robust optimization models are transformed into robust equivalent models that are easy to solve. Finally, a hybrid algorithm based on the ant colony and tabu search (ACO-TS) algorithm solves multiple sets of numerical cases based on the case design of the Bohai Sea area, and analyzes the influence of uncertain parameters on the decision making of MEMD-LRP. The study of MEMD-LRP under uncertain decision-making environments using bi-level programming and robust optimization methods can help decision makers at different levels of the maritime emergency logistics system formulate emergency material reserve locations and emergency material distribution schemes that can effectively deal with the uncertainty in maritime emergencies.",Cong Wang|Zhongxiu Peng|Wenqing Xu,https://openalex.org/A5100390502|https://openalex.org/A5030617980|https://openalex.org/A5103986495,https://orcid.org/0000-0002-8222-2867||,CN|CN|CN,Dalian Maritime University|Southeast University|Dalian Maritime University|Dalian Maritime University,https://openalex.org/I43313876|https://openalex.org/I76569877|https://openalex.org/I43313876|https://openalex.org/I43313876,False|True|False,cc-by,8,https://openalex.org/I43313876,Robust Bi-Level Optimization for Maritime Emergency Materials Distribution in Uncertain Decision-Making Environments,https://doi.org/10.3390/math11194140,Ministry of Education of the People's Republic of China|Natural Science Foundation of Guangdong Province|Jilin Office of Philosophy and Social Science|Jiangsu Planned Projects for Postdoctoral Research Funds|Fundamental Research Funds for the Central Universities|Humanities and Social Science Fund of Ministry of Education of China,3.75060368,,False,en,True,gold,Mathematics,https://openalex.org/S4210192031,2227-7390,journal,Facility Location and Emergency Management,2023-09-30,2023,article
https://openalex.org/W133107828,,Bassem Jarboui|Patrick Siarry|Jacques Teghem,https://openalex.org/A5107385221|https://openalex.org/A5008986898|https://openalex.org/A5082427090,https://orcid.org/0000-0002-0372-6101|https://orcid.org/0000-0002-5722-4115|,||,,,True|False|False,,2,,Metaheuristics for Production Scheduling (ISTE),,,0.64766839,,False,en,False,closed,Wiley-IEEE Press eBooks,https://openalex.org/S4306482864,,ebook platform,Scheduling and Optimization Algorithms,2013-06-24,2013,book
https://openalex.org/W1580682222,,Dortmunder Fuzzy-Tage|Bernd Reusch,https://openalex.org/A5072989625|https://openalex.org/A5067970342,|,|,,,True|False,,2,,"Computational Intelligence. Theory and Applications: International Conference, 5th Fuzzy Days, Dortmund, Germany, April 28-30, 1997 Proceedings",,,0.0,,False,en,False,closed,Medical Entomology and Zoology,https://openalex.org/S4210197683,0424-7086,journal,Fuzzy Logic and Control Systems,1997-04-16,1997,book
https://openalex.org/W4398158964,,Leren Qian|Emanuel Melachrinoudis,https://openalex.org/A5059592646|https://openalex.org/A5085925449,|https://orcid.org/0000-0002-1929-0963,US|US,Northeastern University|Northeastern University,https://openalex.org/I12912129|https://openalex.org/I12912129,True|False,,7,https://openalex.org/I12912129,An integrated neural combinatorial Tabu Search for optimizing school bus scheduling with bell time,https://doi.org/10.1016/j.trc.2024.104662,,4.76729281,,False,en,False,closed,Transportation Research Part C Emerging Technologies,https://openalex.org/S64511102,0968-090X,journal,Vehicle Routing Optimization Methods,2024-05-21,2024,article
https://openalex.org/W2060330757,,Ren Ze-zhu|Yu Zhang,https://openalex.org/A5052554699|https://openalex.org/A5100433414,|https://orcid.org/0000-0001-7889-2676,CN|CN,Harbin University of Commerce|Harbin University of Commerce,https://openalex.org/I41208885|https://openalex.org/I41208885,True|False,,1,https://openalex.org/I41208885,Emergency Logistics Design in Disasters,https://doi.org/10.1109/leits.2010.5664950,,0.0,,False,en,False,closed,,,,,Facility Location and Emergency Management,2010-11-01,2010,article
https://openalex.org/W4412189901,"In this paper, a multi-criteria Vehicle Routing Problem with distance and capacity constraints for modeling a delivery system with parcel locker, is considered. The problem is formulated and two optimization criteria are defined. The first criterion minimizes the total travel time of all vehicles and the second criterion minimizes the total penalty for late delivery of orders. Three solving methods, relying on the concept of Pareto-optimality, are proposed: a greedy constructive heuristic, a Tabu Search metaheuristic and a Genetic Algorithm. A number of benchmark instances are created using real-life parcel locker locations and traveling times, from one of the major cities in Poland. In preliminary research, sorting strategies for the greedy method are tested, with the sorting based on deadline–arrival difference to priority ratio yielding the best performance in all tested cases. Next, computer experiments are performed to evaluate the quality of the proposed methods, using the concept of Hypervolume Indicator. Results confirm that both Tabu Search and Genetic Algorithm significantly improve the solution provided by the greedy algorithm, with Genetic Algorithm being the most effective on average. However, results also indicate that both Tabu Search and Genetic Algorithm have different effectiveness in different cases. It is concluded that the best performance is achieved by both algorithms being used in parallel, complementing each other.",Radosław Idzikowski|Jarosław Rudy|Michał Jaroszczuk,https://openalex.org/A5075243180|https://openalex.org/A5063483962|https://openalex.org/A5099119137,https://orcid.org/0000-0001-5232-1998|https://orcid.org/0000-0003-1095-6041|https://orcid.org/0009-0009-8617-889X,PL|PL|PL,Wrocław University of Science and Technology|AGH University of Krakow|Wrocław University of Science and Technology|AGH University of Krakow|Wrocław University of Science and Technology|AGH University of Krakow,https://openalex.org/I11923345|https://openalex.org/I686019|https://openalex.org/I11923345|https://openalex.org/I686019|https://openalex.org/I11923345|https://openalex.org/I686019,True|False|False,cc-by,2,https://openalex.org/I11923345|https://openalex.org/I686019,Multi-criteria vehicle routing problem for a real-life parcel locker-based delivery,https://doi.org/10.24425/ijet.2025.153624,,7.22046346,,False,en,True,gold,International Journal of Electronics and Telecommunications,https://openalex.org/S202788981,2081-8491,journal,Advanced Manufacturing and Logistics Optimization,2025-07-11,2025,article
https://openalex.org/W4403375102,"The cross-docking process involves unloading raw materials from incoming vehicles and immediately loading them onto outgoing vehicles. This can greatly improve supply chain operations and expedite transportation to the factory. By minimizing warehouse storage expenses, space requirements, and inventory management, the process can be streamlined effectively. In industries where production profiles need to be responsive to market demands, the location of the cross-docking facility and transportation planning are crucial. This article aims to investigate the criteria for selecting a cross-docking location, using a case study of Arta Profile Company in Ardabil. The research population includes all industrial engineers and production planners in the company, with 10 industry experts selected for this study. The analytic network process (ANP) and grey complex proportional assessment (COPRAS-G) methods were used to compare and prioritize cross-docking locations. Additionally, the fuzzy DEMATEL method was used to determine the strength of connections between different locations. The COPRAS-G approach helps decision-makers make informed decisions by evaluating different options and their importance. The industry experts identified 28 criteria for this study. The results from the network analysis method showed that the most important criterion is the vehicle routing problem (VRP), with a value of 0.46. According to the ANP technique, strategic decision-making is the best option. The fuzzy DEMATEL method revealed that distribution centers are the most important factor, followed by reduced delivery/distribution operations, and finally, the cost of late or early delivery.",,,,,,,,cc-by,1,,Investigating cross-docking criteria for raw materials with hybrid MCDM,https://doi.org/10.46544/ams.v29i2.07,,0.42928328,,False,en,True,diamond,Acta Montanistica Slovaca,https://openalex.org/S184108653,1335-1788,journal,Advanced ceramic materials synthesis,2024-10-12,2024,article
https://openalex.org/W2945409803,,Budi Nur Siswanto|Afferdhy Ariffien|Ilham Jayakusuma,https://openalex.org/A5060665515|https://openalex.org/A5032380555|https://openalex.org/A5002903719,||,||,,,True|False|False,,1,,Sistem Routing Proses Delivery Menggunakan Simulated Annealing (Studi Kasus: PT. X),,,0.34260317,,False,en,False,closed,,,,,Management and Optimization Techniques,2019-04-07,2019,article
https://openalex.org/W1974550342,,Saini Yang|Weifeng Ma,https://openalex.org/A5025959037|https://openalex.org/A5100833398,https://orcid.org/0000-0002-3390-8264|,CN|CN,Beijing Normal University|Beijing Normal University,https://openalex.org/I25254941|https://openalex.org/I25254941,True|False,,1,https://openalex.org/I25254941,A Hierarchical Model for Relief Distribution after Earthquake Disaster,https://doi.org/10.1061/41186(421)370,,0.0,,False,en,False,closed,,,,,Facility Location and Emergency Management,2011-07-26,2011,article
https://openalex.org/W3118997631,,Jianghong Feng,https://openalex.org/A5062128276,https://orcid.org/0000-0002-4641-4343,CN,Jinan University,https://openalex.org/I159948400,True,,5,https://openalex.org/I159948400,Application of a Bilevel Programming Model in Disposal Site Selection for Hazardous Waste,https://doi.org/10.1089/ees.2020.0375,,0.66416454,,False,en,False,closed,Environmental Engineering Science,https://openalex.org/S1905899,1092-8758,journal,Optimization and Mathematical Programming,2021-01-05,2021,article
https://openalex.org/W2437396798,,S. R. M. Krishna|V. Kamakshi Prasad|M. N. Seeta Ramanath,https://openalex.org/A5049416243|https://openalex.org/A5110244877|https://openalex.org/A5038855123,https://orcid.org/0000-0002-2290-6108||,IN|IN|IN,"Indian Institute of Management Visakhapatnam|Jawaharlal Nehru Technological University, Hyderabad|Andhra University",https://openalex.org/I4210156205|https://openalex.org/I10874241|https://openalex.org/I100887729,True|False|False,,2,https://openalex.org/I4210156205,Optimal reliable routing path identification in MANET with FTR-AHP model,https://doi.org/10.1109/syscon.2016.7490633,,0.29853518,,False,en,False,closed,,,,,Mobile Ad Hoc Networks,2016-04-01,2016,article
https://openalex.org/W2829567126,"The location-routing problem under emergency with simultaneous relief materials delivery and victim evacuation is studied and modeled.The number of victims is assumed ambiguous, risk preference of the decision maker is considered, and mixed transportation of relief and victims is allowed.A chance-constrained programming model is proposed based on the fuzzy credibility theory, and a genetic algorithm is designed to solve the problem.",Ruoqi Du|Hong Zhou,https://openalex.org/A5014666719|https://openalex.org/A5101398026,|https://orcid.org/0000-0003-0784-4073,CN|CN,Beihang University|Beihang University,https://openalex.org/I82880672|https://openalex.org/I82880672,True|False,cc-by-nc,2,https://openalex.org/I82880672,Location-Routing Problem under Emergency with Simultaneous Relief Delivery and Victim Evacuation,https://doi.org/10.2991/cmsa-18.2018.54,National Natural Science Foundation of China,0.68550852,,False,en,True,hybrid,Advances in intelligent systems research/Advances in Intelligent Systems Research,https://openalex.org/S4220651947,1951-6851,book series,Facility Location and Emergency Management,2018-01-01,2018,article
https://openalex.org/W4383907972,"Dynamic Vehicle Routing Problems (DVRP) have been highly studied by researchers and decision-makers for the last couple of decades with the effect of developments in GPS and mobile digital tools. Particularly, the digital transformation in logistic and supply chain activities under Industry 4.0 paradigm provides a more suitable environment for DVRP applications. In this study, we conduct a bibliometric analysis related to studies in the DVRP area to understand relationships among publications in terms of countries, institutions, citations, journals, authors, etc., and to show related information and possible trends to the current and prospective researchers and decision-makers. A total of 831 articled retrieved from the Scopus database are examined for the analysis. As a result, the highest number of studies are published by researchers in China while the most impactful studies in terms of citations are carried out by researchers affiliated with US institutions. DVRPs have been frequently studied in Industrial/System Engineering and Management Schools whereas journals in transportation science and operations research/industrial engineering have mostly published DVRP studies. From the application side, ride-sharing, ride-hailing, and crowdsourced delivery appear as new trends for DVRPs in terms of co-occurrence analysis. On the other hand, heuristic and metaheuristic solution approaches frequently co-occur with DVRPs.",Mustafa Demirbilek,https://openalex.org/A5050256201,https://orcid.org/0000-0002-1520-2882,,Gaziantep İslam Bilim ve Teknoloji Üniversitesi,https://openalex.org/I4387152122,True,,1,https://openalex.org/I4387152122,A bibliometric analysis of publications related to dynamic vehicle routing problems,https://doi.org/10.51513/jitsa.1230420,,0.28551373,,False,en,True,bronze,Akıllı Ulaşım Sistemleri ve Uygulamaları Dergisi,https://openalex.org/S4210199891,2636-820X,journal,Vehicle Routing Optimization Methods,2023-07-11,2023,article
https://openalex.org/W4293721133,"In the paper we present machine learning algorithms for the problem of optimizing the distribution of parcels in sto-chastic time-dependent networks, which have been built as a part of some Distribution Optimization System. The prob-lem solved was a modified VRPTW (Vehicle Routing Problem with Time Windows) with many warehouses, a heteroge-neous fleet, travel times depending on the time of departure (stochastic time-dependent network) and an extensive cost function as an optimization criterion. To solve the problem a modified simulated annealing (SATM) algorithm has been proposed. The paper presents the results of the algorithm learning process: the calibration of input parameters and the study of the impact of parameters on the quality of the solution (calculation time, transport cost function value) de-pending on the type of input data. The idea is to divide the input data into classes according to a proposed classifica-tion rule and to propose several strategies for selecting the optimal set of calibration parameters. These strategies consist in solving some multi-criteria optimization tasks in which four criterion functions are used: the length of the designated routes, the computation time, the number of epochs used in the algorithm, the number of designated routes. The subproblem was building a network model of travel times that is used in constructed SATM algorithm to determine the travel time between recipients, depending on the time of departure from the start location. An attempt has been made to verify the research hypothesis that the time between two points can be estimated with sufficient accuracy depending on their geographical location and the time of departure (without reference to the micro-scale, i.e. the detailed structure of the road network). The research was conducted on two types of data for Warsaw: from transport companies and one of the Internet traffic data providers. Learning the network model of travel times has produced very promising results, which will be described in the paper.",Zbigniew Tarapata|Wojciech Kulas|Ryszard Antkiewicz,https://openalex.org/A5007713818|https://openalex.org/A5032942348|https://openalex.org/A5022696436,https://orcid.org/0000-0001-8143-7869|https://orcid.org/0000-0003-1489-4407|https://orcid.org/0000-0001-6749-6563,PL|PL|PL,Military University of Technology in Warsaw|Military University of Technology in Warsaw|Military University of Technology in Warsaw,https://openalex.org/I2800249161|https://openalex.org/I2800249161|https://openalex.org/I2800249161,True|False|False,cc-by,3,https://openalex.org/I2800249161,Machine learning algorithms for the problem of optimizing the distribution of parcels in time-dependent networks: the case study,https://doi.org/10.5604/01.3001.0015.8269,,0.3171275,,False,en,True,gold,Archives of Transport,https://openalex.org/S2764754495,0866-9546,journal,Vehicle Routing Optimization Methods,2022-03-31,2022,article
https://openalex.org/W4224281875,,Zihao Chen|Hao Wang|Alaa Khamis,https://openalex.org/A5100434164|https://openalex.org/A5100446064|https://openalex.org/A5032036732,https://orcid.org/0000-0002-0088-987X|https://orcid.org/0000-0001-9301-5989|https://orcid.org/0000-0003-3008-835X,CA|CA|CA,University of Toronto|University of Toronto|General Motors (Canada),https://openalex.org/I185261750|https://openalex.org/I185261750|https://openalex.org/I867584213,True|False|False,,2,https://openalex.org/I185261750,Multi-criteria Optimal Routing for Last-mile Parcel Delivery,https://doi.org/10.1109/sm55505.2022.9758346,,0.3171275,,False,en,False,closed,,,,,Vehicle Routing Optimization Methods,2022-03-06,2022,article
https://openalex.org/W4403382605,,Wensi Li|Theam Foo Ng|Haidi Ibrahim|Shir Li Wang,https://openalex.org/A5075079543|https://openalex.org/A5004013796|https://openalex.org/A5000835810|https://openalex.org/A5059367213,https://orcid.org/0000-0003-0863-449X|https://orcid.org/0000-0002-9529-4456|https://orcid.org/0000-0002-6401-1791|https://orcid.org/0000-0003-4417-3213,CN|MY|MY|MY|MY,Universiti Sains Malaysia|Guilin University of Electronic Technology|Universiti Sains Malaysia|Universiti Sains Malaysia|Sultan Idris Education University,https://openalex.org/I139322472|https://openalex.org/I5343935|https://openalex.org/I139322472|https://openalex.org/I139322472|https://openalex.org/I143923087,False|True|False|False,,4,https://openalex.org/I139322472,A literature review of the state of the art of sustainable waste collection and vehicle routing problem,https://doi.org/10.1080/10962247.2024.2415298,,2.72416732,https://pubmed.ncbi.nlm.nih.gov/39401374,False,en,False,closed,Journal of the Air & Waste Management Association,https://openalex.org/S4210204350,1096-2247,journal,Vehicle Routing Optimization Methods,2024-10-14,2024,review
https://openalex.org/W2072713897,,Jing An|Paul Pangalos|A.H. Aghvami,https://openalex.org/A5101341855|https://openalex.org/A5022369117|https://openalex.org/A5065296493,||,GB|GB|GB,King's College London|King's College London|King's College London,https://openalex.org/I183935753|https://openalex.org/I183935753|https://openalex.org/I183935753,True|False|False,,4,https://openalex.org/I183935753,Novel fuzzy non-dominance shortest path routing and path ordering for QoS aware routing,https://doi.org/10.1109/pimrc.2013.6666732,,0.72414375,,False,en,False,closed,,,,,Network Traffic and Congestion Control,2013-09-01,2013,article
https://openalex.org/W2597612858,"For many applications of optimized transportation management, there is still a large gap between the requirements and the performance of today’s decision support systems. Vehicle routing is no exception. Although there has been a tremendous increase in the ability to solve ever more complex VRPs (partly due to methodological improvements, partly due to the general increase in computing power), the ability to consistently provide better routing plans in shorter time across a variety of instances will give substantial additional savings. With VRP methods that are more powerful and robust, applications that are too large or too complex for routing tools today, will become effectively solvable. For solving a variety of industrial VRPs, some form of approximate solution method is required in a generic vehicle routing tool. Metaheuristics constitute a popular basis for solving rich and large-size VRPs. Variants and hybrids of Large Neighborhood Search, Variable Neighborhood Search, and Iterated Local Search methods have proven remarkable performance lately. Heuristics based on exact methods such as column generation, and hybrid methods, for instance combining exact methods and local search, have recently proven to be highly effective in solving complex VRPs.Parallel computing is one way of improving both performance and robustness of VRP methods. Parallelism nowadays comes in many guises, ranging from low level parallelism to coarse-grained cooperative parallel solvers. We distinguish between task parallelism and data parallelism. Parallel methods in discrete optimization are not new. According to the recent survey of Crainic however, the literature on parallel methods for the VRP is scarce before the year 2000. The survey has 80 references that almost exclusively focus on task parallelization for the VRP. The optimization methods that are utilized by vehicle routing tools of today are tailored to yesterday’s computer architectures and sequential processing. Standard (comm",Christian Schulz|Geir Hasle|Oddvar Kloster|Atle Riise|Morten Smedsrud,https://openalex.org/A5059665527|https://openalex.org/A5003369175|https://openalex.org/A5026720871|https://openalex.org/A5027585348|https://openalex.org/A5083239306,https://orcid.org/0000-0002-2823-3506|https://orcid.org/0000-0003-0546-2792|https://orcid.org/0000-0002-2025-4257|https://orcid.org/0000-0002-6950-3277|,||||,,,True|False|False|False|False,,1,,Parallel Local search for the CVRP on the GPU,,,0.32011236,,False,en,True,green,BIBSYS Brage (BIBSYS (Norway)),https://openalex.org/S4306400255,,repository,Robotic Path Planning Algorithms,2010-01-01,2010,article
https://openalex.org/W2002655346,,Mohamed Baccouche|Jaouad Boukachour|Abdellatif Benabdelhafid,https://openalex.org/A5051510043|https://openalex.org/A5031115258|https://openalex.org/A5109085576,|https://orcid.org/0000-0002-9728-0584|,FR|SE|TN|FR|FR,National Engineering School of Tunis|University of Sfax|Université Le Havre Normandie|Intelligent Machines (Sweden)|Université Le Havre Normandie|Université Le Havre Normandie,https://openalex.org/I4210131288|https://openalex.org/I142899784|https://openalex.org/I141576021|https://openalex.org/I4210159412|https://openalex.org/I141576021|https://openalex.org/I141576021,True|False|False,,1,https://openalex.org/I4210131288|https://openalex.org/I142899784|https://openalex.org/I141576021|https://openalex.org/I4210159412,Hybrid Genetic Algorithm for the Generalised Assignment Problem,https://doi.org/10.3166/jds.14.83-107,,0.0,,False,en,False,closed,Journal of Decision System,https://openalex.org/S119153320,1246-0125,journal,Scheduling and Optimization Algorithms,2005-01-01,2005,article
https://openalex.org/W4321353733,,Rocsildes Canoy|Víctor Bucarey|Jayanta Mandi|Maxime Mulamba|Yves Molenbruch|Tias Guns,https://openalex.org/A5011110739|https://openalex.org/A5059311607|https://openalex.org/A5050624062|https://openalex.org/A5053953296|https://openalex.org/A5088494037|https://openalex.org/A5041230402,https://orcid.org/0000-0003-1810-082X|https://orcid.org/0000-0002-3043-8404|https://orcid.org/0000-0001-8675-8178|https://orcid.org/0000-0002-9122-926X|https://orcid.org/0000-0001-9344-7255|https://orcid.org/0000-0002-2156-2155,GB|CL|GB|GB|GB|BE,Oldham Council|University of O'Higgins|Oldham Council|Oldham Council|Oldham Council|KU Leuven,https://openalex.org/I4210164339|https://openalex.org/I4210144665|https://openalex.org/I4210164339|https://openalex.org/I4210164339|https://openalex.org/I4210164339|https://openalex.org/I99464096,True|False|False|False|False|False,,1,https://openalex.org/I4210164339,Probability Estimation and Structured Output Prediction for Learning Preferences in Last Mile Delivery,https://doi.org/10.2139/ssrn.4363937,,,,False,en,True,green,SSRN Electronic Journal,https://openalex.org/S4210172589,1556-5068,repository,Machine Learning and Algorithms,2023-01-01,2023,article
