id,abstract,authorships.author.display_name,authorships.author.id,authorships.author.orcid,authorships.countries,authorships.institutions.display_name,authorships.institutions.id,authorships.is_corresponding,best_oa_location.license,cited_by_count,corresponding_institution_ids,display_name,doi,funders.display_name,fwci,ids.pmid,is_retracted,language,open_access.is_oa,open_access.oa_status,primary_location.source.display_name,primary_location.source.id,primary_location.source.issn_l,primary_location.source.type,primary_topic.display_name,publication_date,publication_year,type
https://openalex.org/W7125489646,"This study investigates an intermodal routing problem for emergency materials in the early stage of post-disaster recovery, in which the rapid transportation of emergency materials is formulated as the objective. To achieve reliable transportation that can avoid transportation interruption, this study formulates the uncertainty of both emergency materials’ demand and the network capacity by LR triangular fuzzy numbers, and thus explores a reliable routing problem for transporting emergency materials that is further formulated by a fuzzy linear programming model. Considering the decision makers’ cautious attitude on the transportation of emergency materials to avoid transportation interruption, this study adopts chance-constrained programming based on necessity measure to build a solvable reformulation of the proposed model. A numerical case study is carried out to reveal the conflicting relationship between improving the reliability and reducing the time of transporting emergency materials. The decision-makers of the emergency materials transportation organization should select a reasonable confidence level based on the actual decision-making scenario to plan the reliable intermodal route for emergency materials. By comparing with deterministic modeling, this study verifies the feasibility of the modeling the uncertainty of both demand and capacity in avoiding unreliable transportation and enhancing the flexibility of the intermodal routing for emergency materials. By comparing with chance-constrained programming using possibility measure, this study demonstrates the feasibility of the necessity measure in planning the reliable intermodal route. This study further analyzes how the capacity level of the intermodal network, demand level of the emergency materials and stability of the LR triangular fuzzy parameters influence the optimization results. Accordingly, this study emphasizes the importance of objectively evaluating the uncertain demand for emergency materials, and reveals that the enhancement of the capacity level of the intermodal network and stability of LR triangular fuzzy parameters is able to reduce the transportation time of emergency materials and meanwhile maintain a high reliability.",Yu Huang|Haochu Cui|Yue Lu|Yan Sun,https://openalex.org/A5001359020|https://openalex.org/A5123648384|https://openalex.org/A5123636437|https://openalex.org/A5087344137,https://orcid.org/0000-0002-9062-6239|||https://orcid.org/0000-0002-4704-5578,CN|CN|CN|CN,University of Jinan|Shandong University of Finance and Economics|National Development and Reform Commission|Shandong University of Finance and Economics,https://openalex.org/I34949971|https://openalex.org/I59483232|https://openalex.org/I1324363362|https://openalex.org/I59483232,False|False|False|True,cc-by,0,https://openalex.org/I59483232,Modeling a Reliable Intermodal Routing Problem for Emergency Materials in the Early Stage of Post-Disaster Recovery Under Uncertainty of Demand and Capacity,https://doi.org/10.3390/asi9020027,,,,False,en,True,gold,Applied System Innovation,https://openalex.org/S4210217229,2571-5577,journal,Facility Location and Emergency Management,2026-01-23,2026,article
https://openalex.org/W4414980409,"Big Data Analytics (BDA) has become a pivotal enabler of data-driven decision-making across various industrial sectors. This narrative review aims to synthesize existing literature on BDA techniques, tools, and applications to identify their role and impact in decision support systems. The review draws upon scholarly databases such as Scopus, IEEE Xplore, and Google Scholar, utilizing a systematic search strategy with Boolean keyword combinations to retrieve relevant literature. Studies were screened based on inclusion and exclusion criteria, focusing on empirical findings and practical applications of BDA across domains. Findings reveal that techniques such as data mining, predictive analytics, and machine learning offer enhanced accuracy and real-time capabilities, leading to better outcomes in healthcare diagnostics, manufacturing efficiency, and logistics optimization. The utilization of platforms like Hadoop, Spark, and Tableau demonstrates both functional versatility and implementation challenges, influenced by cost, infrastructure, and human capital readiness. Furthermore, the success of BDA initiatives is closely linked to organizational factors including data quality and workforce expertise. Systemic barriers such as strict data policies, fragmented IT infrastructures, and limited data access in low-resource settings impede optimal BDA deployment. This review underscores the need for strategic policy reforms, technological investments, and capacity building to realize the full potential of BDA. By addressing existing limitations and supporting future research directions, organizations can harness BDA to enable informed, agile, and sustainable decision-making.",Aryo Nugroho,https://openalex.org/A5061468794,https://orcid.org/0000-0002-6350-9088,ID,Universitas PGRI Semarang|Universitas PGRI Adi Buana Surabaya,https://openalex.org/I4210111884|https://openalex.org/I4387930225,True,cc-by,0,https://openalex.org/I4210111884|https://openalex.org/I4387930225,"Empowering Decision-Making through Big Data Analytics: A Narrative Review of Techniques, Tools, and Industrial Applications",https://doi.org/10.61978/digitus.v2i3.836,,0.0,,False,en,True,diamond,Digitus Journal of Computer Science Applications,https://openalex.org/S4390573742,3031-3244,journal,Big Data and Business Intelligence,2024-07-31,2024,article
https://openalex.org/W7112517010,,"Matos, Marina A.",,,,,,True,,0,,Minimizar o impacto dos incêndios florestais,,,,,False,en,False,closed,RepositóriUM (Universidade do Minho),https://openalex.org/S4306400624,,repository,Fire effects on ecosystems,2025-07-21,2025,dissertation
https://openalex.org/W4411346030,"This study proposes a bi-objective optimization model for the inventory routing problem with pickup and delivery (IRP–PD) in a closed-loop supply chain, addressing the growing demand for sustainable logistics solutions. The model simultaneously minimizes transportation costs and inventory costs and enhances driver well-being by incorporating regular rest breaks. The network operates within a circular economy framework, where pallets are both delivered and returned for reuse, contributing to waste reduction. A normalized weighted-sum method is initially used to balance the conflicting objectives. However, since the model cannot efficiently solve large-scale instances, we adopt the NSGA-II metaheuristic to generate a Pareto front, enabling decision-makers to explore trade-offs between objectives. The model is tested on a single instance, and the results demonstrate a promising compromise between economic and social goals.",Chaima Zormati|Tarik Chargui|Abdelghani Bekrar|Abdelhakim Artiba,https://openalex.org/A5118268048|https://openalex.org/A5023405464|https://openalex.org/A5044989257|https://openalex.org/A5108101168,|https://orcid.org/0000-0002-8579-2566|https://orcid.org/0000-0003-2721-1505|https://orcid.org/0000-0001-6382-6588,FR|FR|FR|FR,"Laboratoire d'Automatique, de Mécanique et d'Informatique Industrielles et Humaines|Université Polytechnique Hauts-de-France|Centre National de la Recherche Scientifique|Centre National de la Recherche Scientifique|Université Polytechnique Hauts-de-France|Laboratoire d'Automatique, de Mécanique et d'Informatique Industrielles et Humaines|Centre National de la Recherche Scientifique|Laboratoire d'Automatique, de Mécanique et d'Informatique Industrielles et Humaines|Université Polytechnique Hauts-de-France|Université Polytechnique Hauts-de-France|Centre National de la Recherche Scientifique|Laboratoire d'Automatique, de Mécanique et d'Informatique Industrielles et Humaines",https://openalex.org/I4210089617|https://openalex.org/I70348806|https://openalex.org/I1294671590|https://openalex.org/I1294671590|https://openalex.org/I70348806|https://openalex.org/I4210089617|https://openalex.org/I1294671590|https://openalex.org/I4210089617|https://openalex.org/I70348806|https://openalex.org/I70348806|https://openalex.org/I1294671590|https://openalex.org/I4210089617,True|False|False|False,cc-by,0,https://openalex.org/I1294671590|https://openalex.org/I4210089617|https://openalex.org/I70348806,Bi-Objective Optimization for Sustainable Logistics in the Closed-Loop Inventory Routing Problem,https://doi.org/10.3390/engproc2025097029,,0.0,,False,en,True,gold,,,,,Vehicle Routing Optimization Methods,2025-06-16,2025,article
https://openalex.org/W4412884904,"The relevance of the problem. In the post-war period, the issue of efficient organization of production and logistics of construction materials, in particular ready-mixed concrete, which is the basis for the restoration of residential and industrial infrastructure, is of particular relevance. Concrete plants face numerous logistical challenges, including order management, on-time delivery, transportation constraints, and volatile demand. In such conditions, the role of digital twins and intelligent decision support systems is growing. Digital twins allow modeling and optimizing production and logistics processes based on real data in near real time. Methodology. The study applies a systematic approach to the design of digital twins of concrete plant production and logistics using modern methods of simulation modeling, machine learning, and artificial intelligence. A modular information technology architecture has been developed, covering the physical IoT layer, data collection and storage layer, modeling and analytics layer, as well as integration with ERP, CRM, WMS, TMS, MES/EAM, and SCADA. Decision trees, random forests, and neural networks are used as machine learning models to analyze the efficiency of ready-mixed concrete logistics in real time. Results. A generalized model of a digital twin of a concrete enterprise is proposed, which allows combining production processes, order management, logistics, and analytics into a single intelligent information system. Machine learning models for analyzing the efficiency of logistics in real time, which take into account the state of the transport fleet, capacity utilization, delivery schedules, order priority, etc., are considered. Novelty. For the first time, a holistic information technology of a digital twin of the production and logistics system of a concrete industry enterprise is proposed, which integrates the technologies of the industrial Internet of Things, simulation multi-agent modeling, and machine learning methods. The integration of ML models with IoT data allows for automatic adjustment of production and logistics scenarios, unlike the existing order management system, IoT platform of concrete mixers, and dispatching system, which allows for an increase in the efficiency of predictive analytics of ready-mixed concrete logistics. Practical significance. The proposed approaches can be implemented in concrete enterprises of various sizes, both as part of the reconstruction of existing plants and in the construction of new mobile concrete plants. They provide increased forecasting accuracy, reduced costs, improved customer service, and reduced environmental impact through logistics optimization.",Mikhailo Buhaievskyi|Yuri Petrenko,https://openalex.org/A5091984607|https://openalex.org/A5036783412,https://orcid.org/0000-0002-9844-3146|https://orcid.org/0000-0002-4596-8870,|,,,True|False,,0,,Machine learning models for analyzing the efficiency of ready-mixed concrete production and logistics,https://doi.org/10.30977/bul.2219-5548.2025.109.0.48,,0.0,,False,en,True,diamond,Bulletin of Kharkov National Automobile and Highway University,https://openalex.org/S4210204894,2219-5548,journal,Industrial Engineering and Technologies,2025-07-04,2025,article
https://openalex.org/W4409175240,,Zhifu Mi|R. Gao X.Q. Wang H. Wang|Canghong Wang,https://openalex.org/A5084869905|https://openalex.org/A5019941149|https://openalex.org/A5035803583,https://orcid.org/0000-0001-8106-0694||https://orcid.org/0000-0002-9067-1646,CN|MM|CN,Shandong University|Shandong Management University|Yangon University of Economics|Xi'an Peihua University,https://openalex.org/I154099455|https://openalex.org/I4210097214|https://openalex.org/I3130081645|https://openalex.org/I4210139547,True|False|False,,0,https://openalex.org/I154099455|https://openalex.org/I4210097214,A Blockchain-Based Smart Contract Framework for Enterprise Intellectual Property Management,https://doi.org/10.1142/s0218126625503311,,0.0,,False,en,False,closed,Journal of Circuits Systems and Computers,https://openalex.org/S167602672,0218-1266,journal,Blockchain Technology Applications and Security,2025-04-05,2025,article
https://openalex.org/W4414559787,"Three families of decision support problems are addressed in different areas of industrial applications.The first deals with planning and scheduling for waste management, aiming to determine an efficient organization under resource constraints. The work focuses on hazardous industrial waste and waste from nuclear dismantling.The second family of problems is the pooling of logistics flows to reduce the impact of transport. The optimization of transhipment and the reduction of distances traveled in vehicle routing are problems that seek an efficient organization in space by exploiting network structures. The work includes the automation of transhipment platforms taking into account their energy consumption, and the efficiency of order picking in traditional platforms with little to no automation. In addition, research is conducted on the uncertainty of demands and travel times in the context of urban freight transport, in the context of the inventory routing problem and with heterogeneous vehicle fleets in terms of energy vectors and capacities.Finally, railway maintenance problems link the two previous domains by determining a time organization under resource constraints, while exploiting a network structure. The objective is to find a time organization under resource constraints by exploiting the network structure. Decision support models are proposed to organize the maintenance of ballast and vegetation around the tracks. These maintenance works, carried out by machines passing on the tracks, must be planned taking into account the availability of the tracks. The problems studied share common characteristics, in particular the multi-criteria aspect of the decision and the management of uncertainty. These aspects are important both in the scheduling of production to generate less hazardous industrial waste and in the planning of railway maintenance, both related to environmental issues. The integration of life cycle analysis makes it possible to determine which scheduling problems make it possible to reduce waste and to size heterogeneous vehicle fleets for urban delivery. The resolution approaches used include linear programming, integer linear programming, optimization-simulation coupling, the development of dedicated matheuristics and metaheuristics.",Anne-Laure Ladier,https://openalex.org/A5019415689,https://orcid.org/0000-0002-4201-4430,FR,Decision & Information Sciences for Production Systems,https://openalex.org/I4210131384,True,,0,https://openalex.org/I4210131384,"Réduire les déchets, mutualiser les flux : planification et ordonnancement pour une écologie industrielle",,,,,False,en,True,green,SPIRE - Sciences Po Institutional REpository,https://openalex.org/S4406922440,,repository,Sustainable Industrial Ecology,2024-11-20,2024,other
https://openalex.org/W1570739201,,Sara|Jean‐Daniel Zucker|Lorenza Saitta,https://openalex.org/A5049697300|https://openalex.org/A5088630634|https://openalex.org/A5006349769,|https://orcid.org/0000-0002-5597-7922|,||,,,True|False|False,,0,,"Abstraction, Reformulation and Approximation: 6th International Symposium, SARA 2005, Airth Castle, Scotland, UK, July 26-29, 2005, Proceedings",,,0.0,,False,en,False,closed,Medical Entomology and Zoology,https://openalex.org/S4210197683,0424-7086,journal,"Logic, Reasoning, and Knowledge",2005-09-01,2005,book
https://openalex.org/W4416965037,"In this work, we consider learning-based applications in routing to solve a Vehicle Routing variant characterized by stochasticity and multiple objectives. Such problems are representative of practical settings where decision-makers have to deal with uncertainty in the operational environment as well as multiple conflicting objectives due to different stakeholders. We specifically consider travel time uncertainty. We also consider two objectives, total travel time and route makespan, that jointly target operational efficiency and labor regulations on shift length, although different objectives could be incorporated. Learning-based methods offer earnest computational advantages as they can repeatedly solve problems with limited interference from the decision-maker. We specifically focus on end-to-end deep learning models that leverage the attention mechanism and multiple solution trajectories. These models have seen several successful applications in routing problems. However, since travel times are not a direct input to these models due to the large dimensions of the travel time matrix, accounting for uncertainty is a challenge, especially in the presence of multiple objectives. In turn, we propose a model that simultaneously addresses stochasticity and multi-objectivity and provide a refined training mechanism for this model through scenario clustering to reduce training time. Our results show that our model is capable of constructing a Pareto Front of good quality within acceptable run times compared to three baselines.",Abdo Abouelrous|Laurens Bliek|Yaoxin Wu|Yingqian Zhang,https://openalex.org/A5081809653|https://openalex.org/A5076977147|https://openalex.org/A5059325642|https://openalex.org/A5077147157,https://orcid.org/0000-0003-3670-5136|https://orcid.org/0000-0002-3853-4708|https://orcid.org/0000-0002-3625-6599|https://orcid.org/0000-0002-5073-0787,|||,,,True|False|False|False,cc-by,0,,End-to-end Deep Reinforcement Learning for Stochastic Multi-objective Optimization in C-VRPTW,https://doi.org/10.48550/arxiv.2512.01518,,,,False,,True,green,arXiv (Cornell University),https://openalex.org/S4306400194,,repository,,2025-12-01,2025,preprint
https://openalex.org/W7125941550,"This paper presents a fuzzy multi-objective optimization model for the Green Location-Routing Problem (GLRP) in competitive UAV delivery networks. The model simultaneously optimizes total cost, carbon emissions, and service time while determining facility locations and UAV routes under realistic constraints: capacity, energy, and no-fly zones. To address inherent uncertainties in customer demand and travel times, we develop a fuzzy logic framework that generates robust Pareto-optimal solutions for different confidence levels (α). The resulting fuzzy model is solved using three meta-heuristic algorithms: NSGA-II, MOACO, and MOSA. Numerical results demonstrate that the proposed fuzzy approach yields a more practical and cost-effective design compared to deterministic models, effectively balancing economic and environmental objectives under uncertainty. This study offers logistics managers a robust decision-support tool for sustainable UAV network deployment.",Mehdi Shahegh|Behnam Vahadani|Farhad Eatebari,https://openalex.org/A5124120259|https://openalex.org/A5124101757|https://openalex.org/A5124131625,||,IR|IR|IR,Qazvin Islamic Azad University|Qazvin Islamic Azad University|Qazvin Islamic Azad University,https://openalex.org/I197220011|https://openalex.org/I197220011|https://openalex.org/I197220011,True|False|False,cc-by,0,https://openalex.org/I197220011,A Fuzzy Multi Objective Optimization Model For A Sustainable And Competitive Uav Delivery Network Under Uncertainty,https://doi.org/10.5281/zenodo.18397859,,,,False,,True,green,Zenodo (CERN European Organization for Nuclear Research),https://openalex.org/S4306400562,,repository,UAV Applications and Optimization,2026-01-28,2026,article
https://openalex.org/W7125975544,"This paper presents a fuzzy multi-objective optimization model for the Green Location-Routing Problem (GLRP) in competitive UAV delivery networks. The model simultaneously optimizes total cost, carbon emissions, and service time while determining facility locations and UAV routes under realistic constraints: capacity, energy, and no-fly zones. To address inherent uncertainties in customer demand and travel times, we develop a fuzzy logic framework that generates robust Pareto-optimal solutions for different confidence levels (α). The resulting fuzzy model is solved using three meta-heuristic algorithms: NSGA-II, MOACO, and MOSA. Numerical results demonstrate that the proposed fuzzy approach yields a more practical and cost-effective design compared to deterministic models, effectively balancing economic and environmental objectives under uncertainty. This study offers logistics managers a robust decision-support tool for sustainable UAV network deployment.",Mehdi Shahegh|Behnam Vahadani|Farhad Eatebari,https://openalex.org/A5124120259|https://openalex.org/A5124101757|https://openalex.org/A5124131625,||,IR|IR|IR,Qazvin Islamic Azad University|Qazvin Islamic Azad University|Qazvin Islamic Azad University,https://openalex.org/I197220011|https://openalex.org/I197220011|https://openalex.org/I197220011,True|False|False,cc-by,0,https://openalex.org/I197220011,A Fuzzy Multi Objective Optimization Model For A Sustainable And Competitive Uav Delivery Network Under Uncertainty,https://doi.org/10.5281/zenodo.18397858,,,,False,,True,green,Zenodo (CERN European Organization for Nuclear Research),https://openalex.org/S4306400562,,repository,UAV Applications and Optimization,2026-01-28,2026,article
https://openalex.org/W7114901500,"The rapid growth of web-based applications has attracted increasing attention from cybercriminals, particularly within the expanding field of the internet of transportation things, which has diverse applications across industries such as healthcare. As internet of transportation things technologies are adopted more widely, significant challenges emerge, particularly regarding data and service security. Hackers are specifically targeting sensitive medical data during the transportation of health emergency services, with internet of transportation things devices utilized for remote patient monitoring, medical equipment tracking, and logistics optimization. This research aims to tackle these security concerns by evaluating the risks associated with maintaining data integrity in healthcare emergency services. The research also utilizes a symmetrical fuzzy decision-making methodology, Fuzzy ANP-TOPSIS, to evaluate diverse security concerns associated with the internet of transportation things, with an emphasis on healthcare applications. The case study of seven alternatives reveals that mediXcel electronic medical records are the most viable solution, whilst the Caresoft system for hospital information is considered the least effective. The findings provide critical insights for improving the security of internet of transportation things applications and assuring their seamless integration into healthcare, especially in emergency services, hence protecting patient data and fostering user confidence.",Waeal J. Obidallah,,https://orcid.org/0000-0002-5086-3950,SA,Imam Mohammad ibn Saud Islamic University,https://openalex.org/I240666556,True,cc-by,0,https://openalex.org/I240666556,A Unified Computational Model for Assessing Security Risks in Internet of Transportation Things-Based Healthcare Applications,https://doi.org/10.3390/electronics14244894,,0.0,,False,en,True,gold,Electronics,https://openalex.org/S4210202905,2079-9292,journal,Organizational and Employee Performance,2025-12-12,2025,article
https://openalex.org/W4385199912,,Leren Qian|Emanuel Melachrinoudis,https://openalex.org/A5111013432|https://openalex.org/A5085925449,|https://orcid.org/0000-0002-1929-0963,MX|MX,Universidad del Noreste|Universidad del Noreste,https://openalex.org/I87182695|https://openalex.org/I87182695,True|False,,0,https://openalex.org/I87182695,An Integrated Neural Combinatorial Tabu Search for School Bus Routing Optimization with Bell Time,https://doi.org/10.2139/ssrn.4519615,,,,False,en,True,green,SSRN Electronic Journal,https://openalex.org/S4210172589,1556-5068,repository,Web Applications and Data Management,2023-01-01,2023,preprint
